title,label
wikileaks bombshell there is no us election,FAKE
all governments lie the movie,FAKE
trump is deadbeating on his campaign debts by refusing to pay his own pollster,FAKE
is halloween evil why witches occultists and satanists celebrate halloween and why you should not,FAKE
yes creationists can be real scientists too,FAKE
5 things you need to know about the dakota access pipeline protests,FAKE
comment on corporate democratic party think tank third way exposed by dear centrists the left has something to say whether you like it or not,FAKE
luis lzaro tijerina americans and the trump victory   russia news now,FAKE
what is one more election thread ehhh,FAKE
germany children in one school required to chant allahu akbar in another christian events eliminated,FAKE
senator mark kirk mocks disabled veteran tammy duckworth for mixed race heritage,FAKE
need to burn fat eat dinner early or skip it to help weight loss,FAKE
anti trump protesters are tools of the oligarchy      information,FAKE
breaking wikileaks just released full isis donor list with names,FAKE
one veterans war on islamophobia,FAKE
nanny in jail after force feeding baby to death,FAKE
hillary clinton tops islamist money in politics list,FAKE
the american way socialism for the rich free enterprise for the rest,FAKE
trump will be president   how alt market predicted the outcome five months in advance,FAKE
trump allows 3 million people to escape us,FAKE
blog if donald trump pardons me i would be honored to serve as secretary of agriculture,FAKE
no pain no gain lockheed struggles to finalize deal with pentagon on f 35 lots,FAKE
video journalist covering pipeline protests shot while conducting interview,FAKE
shameful obama legacy white man beaten viciously for voting trump,FAKE
facebook lets advertisers exclude users by race,FAKE
why any wife mother daughter sister or feminist must vote trump,FAKE
post maidan ukraine has become a full fledged totalitarian state   volodymyr chemerys,FAKE
even hillarys niece is voting trump,FAKE
us insiders  not russia  leaked clinton emails,FAKE
ten interesting facts about vladimir putin,FAKE
harry reid just accused fbi of hiding explosive info about trump  putin,FAKE
life 7 incredible animal mating rituals,FAKE
koch brothers battle to prevent dark money disclosure in south dakota,FAKE
russia has shot from 124th to 40th in ease of doing business,FAKE
private equity consultant hamilton lane trots out new excuse evil populists for already flagging private equity performance,FAKE
asda shoppers just generally angry,FAKE
comeys clinton foundation connection,FAKE
life when these third graders saw their classmate didnt have a lunch they kept feeding him more and more lunches until he clogged the door and got school canceled,FAKE
russia or the neocons who endangers american democracy  offguardian,FAKE
mccain pledges to help pentagon fix scandal over excessive military bonuses,FAKE
doctors restore ken burns full color vision after removing massive tumor from filmmakers visual cortex   the onion   americas finest news source,FAKE
a christmas story  there is no better purpose than to serve others,FAKE
trump proudly declares most of the people ive insulted deserved it,FAKE
new york times tries to compare comey to hoover here are 4 reasons thats idiotic,FAKE
when charlottesville was nuked,FAKE
most idiotic comment ever sell gold because inflation will spike,FAKE
comment on elections 2012 16 by beammeupscotty,FAKE
ufo investigator   max spiers   found dead after vomiting black liquid,FAKE
nypd source weiner laptop has enough evidence to put hillary  away for life,FAKE
why is it the first time im hearing about this asks office wanker,FAKE
aids patient zero not the source of the outbreak,FAKE
hey bernie supporters here are 45 times hillary promoted the tpp   truthfeed,FAKE
new rnc ad campaign reminds voters obamacare was originally hillarycare,FAKE
house republicans plan secret meeting to discuss overthrowing paul ryan,FAKE
solar powered pipe desalinates 15 billion gallons of drinking water a year for california,FAKE
hate speech as a weapon reporters are charged for covering disturbances,FAKE
unesco passes anti israel resolution despite tel aviv brickbats,FAKE
hillarys healthcare fix exposed millions of americans will end up dead,FAKE
comment on 4 reasons why your diet sucks by the most important concepts the manosphere taught me,FAKE
dnc renews lawsuit against rnc over voter intimidation video,FAKE
va hospital honors decorated veteran of three wars with free side of mashed potatoes  gomerblog,FAKE
beck comey letter one of the most irresponsible things to ever happen,FAKE
deutsche bank considering alternatives to paying cash bonus,FAKE
dakota access pipeline protesters occupy hillary clinton campaign hq,FAKE
the greatest wealth transfer in history nears as deep state now pulling out all the stops,FAKE
dapl protesters proven right as largest gas pipeline in us experiences massive and deadly explosion,FAKE
sanders calls trump political coward over voter suppression report,FAKE
freeing yourself from overwhelm,FAKE
feds 275000 born to illegals in 1 year,FAKE
november kale,FAKE
hillary clinton hits unfavorability high of 60 higher than trump,FAKE
military veterans are helping to save coral reefs by combating climate change,FAKE
the real reason obamacare is coming unglued,FAKE
desperate trump supporter offers voters discount on horse semen if they vote trump,FAKE
not guilty the power of nullification to counteract government tyranny,FAKE
vote as if your life depended upon it because it does,FAKE
north korea threatens sacred nuclear war against israel if this country continue supporting isis,FAKE
more footage of operation high jump with hitler,FAKE
more reports of votes flipping from trump to clinton in texas election officials dismiss concerns an ongoing cbs4 voter fraud investigation finds people voting twice,FAKE
like a concentration camp police mark dapl protesters with numbers and lock them in dog kennels,FAKE
the passion behind standing rock protest,FAKE
trump adviser says israeli settlements not illegal,FAKE
cant trust obama look at sick thing he just did to stab trump in the back  liberty writers news,FAKE
hillary melts down over weiner in public pics prove campaign is imploding,FAKE
us kurdish troops will be involved in invading isis capital of raqqa,FAKE
comment on cops attempt to abuse his authority during fit of road rage is shutdown by informed citizen by jynxster,FAKE
cbd infused cannabis milk soothes anxiety and is hitting stores soon,FAKE
reductress  this little girls mind blowing protest speech is everything her mother told her to say,FAKE
deep fried offshore,FAKE
youre fired trump wins big clinton is going to jail,FAKE
trump team begins making list of executive orders to erase obamas presidency on day one,FAKE
us calls for end to saudi airstrikes in yemen,FAKE
western banking system collapse  jim willie,FAKE
links 111216,FAKE
ben shapiro destroys john oliver on abortion and trump  daily wire,FAKE
att sold access to customer data to law enforcement   report,FAKE
russia to test new anti tank guided missiles in syria,FAKE
hillary clinton is now radioactive   sot 122,FAKE
coping with extreme weather if youre stranded outside,FAKE
world proud of its calm measured response to trump victory,FAKE
washington post anti trump scare tactics,FAKE
the fbis clinton investigation is wider than assumed,FAKE
trump bollywood ad meant to sway indian american voters is an hilarious fail video,FAKE
more beer less vodka as russians mull ongoing crisis   rustem falyakhov,FAKE
mccarthyism rides again and its again poisoning the foundations of a free society in the us   justin raimondo,FAKE
re early voting results in key battleground states appear to favor donald trump,FAKE
obamacare is meant to fail in order to usher in government run socialist health care,FAKE
comment on due process is dead a staggering 95 of all inmates in america have never received a trial by raymond karczewski,FAKE
economic nationalism alternative to globalism,FAKE
were all going to lose on november 8th get prepped with this post election chaos checklist video,FAKE
noam chomsky and ralph nader recently had their first public conversation video,FAKE
pa lawmakers approve ban on naming officers in shootings,FAKE
florida voters approve medical marijuana reject federal prohibition,FAKE
assange clinton campaign tried to hack wikileaks,FAKE
shocking scientists reveal the universe could delete itself at any moment,FAKE
three ways to recharge your energy using crystals,FAKE
flashback clinton cheered 11th hour indictment that doomed bush re election,FAKE
we the people against tyranny seven principles for free government,FAKE
humas weiner dogs hillary,FAKE
muslims are kidnapping white girls and forcing them into sex slavery says uk childrens charity,FAKE
breaking white house abandons tpp  ttip,FAKE
if you live here forget christmas lights   theyve been banned to avoid offending refugees,FAKE
project veritas 4 robert creamers illegal 20000 foreign wire transfer caught on tape,FAKE
paris migrant campers increase after calais is shut,FAKE
report exposes inner workings of facebook and how clinton loyalists control your newsfeed,FAKE
giuliani on fbis exoneration of hillary we are supposed to be a country of justice,FAKE
comment on 10 more beautiful images that remind you we still live in a beautiful world with beautiful people by 10 more beautiful images that remind you we still live in a beautiful world with beautiful people   upside down media,FAKE
4 times as many americans think biased us media   not foreign interests such as russian hackers   real threat to fair election,FAKE
paper tiger isis digs into mosul,FAKE
iranians had every right to take over us embassy  veterans today,FAKE
election 2016 and the weaponization of the american public,FAKE
trumpocalypse  5 ridiculously outdated assumptions every statist makes,FAKE
steve pieczenik us intelligence waging coup against corrupt clintons  regated,FAKE
trump supporters lose control violently harass reporters at rally video,FAKE
election 2016 a political system in crisis,FAKE
new exoplanet discoveries reveal red dwarf stars as likely hosts to large populations of earth like water worlds,FAKE
pentagon seeks another 6 billion for overseas troop deployments,FAKE
facebook nazi thought police editors threaten to quit if mark zuckerberg doesnt ban donald trump for hate speech,FAKE
trump vows to renovate the bill of rights,FAKE
breaking putin issues massive warning to the west,FAKE
the failure of us democracy,FAKE
north dakota police arrest over 140 pipeline protesters,FAKE
gold prices grow by 60 as trump wins us dollar trashed,FAKE
who cancer agency under fire for withholding carcinogenic glyphosate documents,FAKE
teenager enamored with isis in court over viable device found on london underground,FAKE
re ha fbi reopening hillary email case means this might happen again soon hint bill fire up the jet,FAKE
wikileaks,FAKE
dnc head leaked 2nd debate question to hillary,FAKE
three local military veterans to receive recognition,FAKE
police turn in badges rather than incite violence against standing rock protesters report,FAKE
breaking massive voter fraud in broward county florida linked to ex dnc chairwoman debbie wasserman schultz   magafeed,FAKE
isis mortal threat or paper tiger,FAKE
politicians will feel the heat from rising temperatures,FAKE
russian pianist denis matsuev terrorized in us for supporting putin,FAKE
re the us will lose global reserve status expect 80 90 devaluation of the us dollar,FAKE
sex bombshell exposed after hillary couldnt hide what she did back in 2011,FAKE
can the american people defeat the oligarchy that rules them,FAKE
a trump supporter just held six children at gunpoint for dumbest reason ever,FAKE
top eu official disputes that trump could upend iran nuclear deal,FAKE
half of russians fear syria could spark ww3,FAKE
hillary finally concedes this is painful and it will be for a long time,FAKE
floridas deceptive solar initiative backed by utilities companies loses support,FAKE
military op to retake mosul from isis,FAKE
comment on boy says farewell to best friend 91 year old world war ii vet from next door by joe,FAKE
hillarys big tent is obamas grand bargain on steroids,FAKE
cher finally cracks time travel,FAKE
hillary clinton jumps the shark with trumps secret russian server conspiracy theory,FAKE
us japan push to fortify alliances amid threat posed by north korea,FAKE
assassination attempt at reno trump rally,FAKE
fema area emergency tests broadcast just before election,FAKE
delete your account   episode 23 dont get sick,FAKE
gay trump supporters getting death threats from gay people who support a candidate who receives multi million dollar contributions from countries that execute gays,FAKE
your facebook page could land you in a fema camp,FAKE
bill clintons lover he called ruthless hillary the warden,FAKE
susan rice us must integrate lgbt rights into govt and foreign policy,FAKE
how grey are the white helmets and their backers,FAKE
former dea prescription head drops a bombshell  congress protects big pharma  fuels opioid crisis,FAKE
putin congratulates trump says russia is ready to restore relations with the us,FAKE
a materialist analysis of why i am voting green and why the left should do the same,FAKE
200pm water cooler 1112016,FAKE
breaking vp candidate mike pences plane skids off runway tears up tarmac at nyc airport,FAKE
deepwater horizon continues to impact public health,FAKE
seth meyers takes a closer look at the gops threats against hillary and its terrifying video,FAKE
newt gingrich goes berserk when fox news megyn kelly referred to trump as a sexual predator,FAKE
hillary is done after blunt cowboy makes shocking announcement on live tv,FAKE
love him or hate him trump is the revolution against the establishment,FAKE
cops ambushed in iowa,FAKE
cnn fired donna brazile 2 weeks ago made it public now after wikileaks revelation,FAKE
saudi arabia to behead disabled man for taking part in protests,FAKE
trump gives 6 reasons to vote for him,FAKE
microsoft outlook to introduce hillary button to delete emails en masse,FAKE
us insiders   not russia   leaked clinton emails,FAKE
breaking  trump beating federal investigation hillary by 4 in michigans absentee voting   truthfeed,FAKE
how to lower blood pressure naturally,FAKE
hillary clinton attempted to hack wikileaks and delete everything assange,FAKE
bombs ready the american blob is already oozing into syria   ryan cooper,FAKE
september new homes sales rise back to 1992 level,FAKE
american and saudi weapons recoverd from isis positions in mosul,FAKE
the she devil,FAKE
obamacare architect gruber demands larger mandate penalty,FAKE
banana republic election in the united states,FAKE
mufon international tracking multiple triangle ufo reports,FAKE
hillary is so unpopular she has to pay off youth voters and fabricate her rallies,FAKE
putins army is coming for world war 3 against obama year 2016 new video kopya,FAKE
black americans going for donald trump in record numbers as election day approaches,FAKE
putin mocks clinton claim of russia election meddling is us a banana republic,FAKE
the penalty for treason is video,FAKE
us abstains from un vote calling for end to cuban embargo,FAKE
assange destroys hillary clinton in his most provocative interview ever watch,FAKE
strange thing moving up alaskas chena river caught on video,FAKE
puh leeze dojs policy reminder to fbi is shameless especially considering this   twitchycom,FAKE
twitter has been looking into the future read the best 16 predictions,FAKE
be sure to join our election night live blogopen thread tomorrow evening,FAKE
comment on st charles borromeo patron saint of catechists and seminarians by jose,FAKE
electric floors could generate renewable energy from walking,FAKE
is this what you think they would look like supposed pictures of real extraterrestrials,FAKE
urban population booms will make climate change worse,FAKE
the war on drugs is a racket,FAKE
interview sarah anastasia muslim makeup artist and skin care consultant,FAKE
standing rock indian reservation thousands of wild buffalo appear out of nowhere,FAKE
busted bill recorded telling mistress to deny that clintons helped her get a state job,FAKE
vortex structured water video,FAKE
emergency congress considers historic action over comeys re opening of emailgate,FAKE
lds churchs new mormon and gay website wins cheers and some jeers for ignoring controversial policy,FAKE
russian report warns american revolution has now begun may last entire decade,FAKE
while the fbi investigates hillary  wikileaks swoops in to kick her while shes down,FAKE
28 alternative uses for life saving mylar emergency blankets,FAKE
top 10 toxins that are poisoning your kids,FAKE
video proof hillarys frail health is becoming an issue,FAKE
oathkeepers to prevent voter fraud  operation sabot,FAKE
best of luck with the wall,FAKE
russia may run out of patience and respond to usas rudeness,FAKE
fbi investigates saudi wife abusing clinton foundation donor in straw donor scheme,FAKE
michael moore owes me 499,FAKE
racist sign calls for lynching black people to prevent them from getting equal rights,FAKE
syria conflict food rations run out in rebel held aleppo,FAKE
news hope for the gop a nude paul ryan has just emerged from an ayahuasca tent with visions of a new republican party,FAKE
trump panics as 28 of florida gop early votes go to hillary video,FAKE
now more than ever we must tell the truth about the iraq war,FAKE
will trump be different than hillary or obama sot 125,FAKE
blind mystic who predicted 911 has bad news about trump,FAKE
israel snubs unescos temple mount resolution with ancient jerusalem papyrus,FAKE
comment on colin kaepernick just started a black panther inspired youth camp to teach kids to fight oppression by europeannationalityethnicity,FAKE
reduce nurse burnout by treating nurses as well as we treat patients,FAKE
us government acknowledges that al qaeda is not a priority in syria,FAKE
hillary and trump could both be criminally charged after the election,FAKE
fbi getting warmer pay to play,FAKE
the next 10 years will be ugly for your 401k,FAKE
malala announced that she plans to become prime minister of pakistan,FAKE
hillary admits creation of mujahedin plague,FAKE
bloomberg backed pennsylvania attorney general sentenced to 10 23 months in prison,FAKE
new report finds voters have no idea how outraged they supposed to be about anything anymore   the onion   americas finest news source,FAKE
former dea prescription head drops a bombshell  congress protects big pharma  fuels opioid crisis,FAKE
a perfect mashup of stranger things and a charlie brown christmas,FAKE
iraqi christians return to charred churches captured from isis,FAKE
homeless man looking a bit down today for some reason,FAKE
the splcs libelous new report on anti muslim extremists,FAKE
what a hillary presidency would bring,FAKE
punk targets hurricane victims home flees when surprised by armed owner,FAKE
duterte calls us admin monkeys for halting arms sales,FAKE
uk announces new troop deployment near russias borders,FAKE
cop fired after shooting own 11 year old daughter at a halloween party,FAKE
presstv huge blast kills 47 in pakistans balochistan,FAKE
globalization expressway to universal slavery,FAKE
us engineers prepare bionic device to generate electricity by walking,FAKE
the ruthlessly effective rebranding of europes new far right,FAKE
trumps new ad portraying every mothers worse nightmare is nothing short of chilling,FAKE
heres proof the gold price is based on cost not supply and demand,FAKE
obama furious after fed up deplorables drop 41000 piece gift on him,FAKE
comment on chicago tribune hillary clinton should drop her campaign to be potus by stevor,FAKE
a collection of thoughts about american foreign policy,FAKE
is your vaccinated child a haz mat,FAKE
representative government or thugocracy,FAKE
pharrell williams begs women to vote hillary shes dishonest but so are you,FAKE
even doctors are surprised this recipe renews the knees and joints,FAKE
top 5 unusual tragic deaths on sets,FAKE
facebook user wastes two hours sharing things to impress his insurance company,FAKE
creating an anti muslim bias at a canadian university,FAKE
heres how goldman sachs lays people off  financial markets,FAKE
an open letter to black south african police officers,FAKE
russia is hoarding gold at an alarming rate  the next world war will be fought with currencies,FAKE
how the oligarchs plan to steal the election,FAKE
turkey rounds up erdogans political opponents as crackdown widens,FAKE
colin kaepernick hosts know your rights camp for oakland area youth,FAKE
anti establishment trump plans to appoint goldman sachs and george soros insiders,FAKE
anti trump protests are paid and staged craigslist reveals,FAKE
low cost wind turbine to power an entire house for a lifetime starts selling in india,FAKE
video  black professor black voters are breaking for trump,FAKE
clintons are under multiple fbi investigations as agents are stymied,FAKE
huffington post continues campaigning for hillary clinton,FAKE
white house cancels all obama appearances at hillary campaign events    redflag news,FAKE
trumps proposed student loan program makes him look more liberal than obama republicans fuming,FAKE
comment on seattle council member proposes a massive fee hike for pot shops by steven broiles,FAKE
israel tracked anti government journalists on facebook,FAKE
cnn talker famous for saying pu on air lashes out at newt for saying megyns obsessed with sex,FAKE
drones are officially cleaning up ocean trash watch,FAKE
travel conor mcgregors guide to new york,FAKE
election heats up kerry heads to the polesin antarctica wtf,FAKE
life lucky break this teen boy just got another 4 years to plan his viral coming out video,FAKE
will draftourdaughters bring hillary down,FAKE
some fla residents plan armed trick or treating after creepy clown threats,FAKE
undercover video exposes obamas plan to make american gun laws more like britain   truthfeed,FAKE
podesta brothers kidnapped a 3yo british girl in portugal   wikileaks,FAKE
mourning in americaa patriot spring in europe,FAKE
for the small price of 23 million you could own this beautiful self sufficient island,FAKE
whose side is russia on in syria,FAKE
voting is the problem heres the solution,FAKE
comment on election 2016 playing a game of chicken with nuclear strategy by pretzelattack,FAKE
evidence reveals possible link between voting machines and clinton foundation,FAKE
will the deep state win the election,FAKE
clinton campaign stunned as fbi reportedly reopens probe into hillary clinton emails,FAKE
how to choose the best batteries for prepper solar systems,FAKE
united we grand   the onion   americas finest news source,FAKE
putin crimean integration into russian legal framework goes forward,FAKE
financial times fumbles trumps central banking criticism,FAKE
cardinal vincent nichols says britons could learn a lot from the vibrant faith of muslim migrants,FAKE
japans lost black hole satellite took this last photo proves something mind boggling,FAKE
hillary clinton v donald trump in 2016,FAKE
breaking huma abedin thrown off hillarys campaign plane,FAKE
have you heard scientists now growing human ears from apples,FAKE
ex fbi assistant director calls the clintons a crime family and claims their foundation is a cesspool,FAKE
abedin  weiner to testify against clinton,FAKE
tonopah test range google earth imagery 7222016,FAKE
youtube bans clintons black son,FAKE
armstrong stop trying to make temple attacks about race,FAKE
his fans are calling trump brave but heres how hillary faced down man who stormed stage video,FAKE
donald groped hillary in 2005 trump and weiner sext each other,FAKE
this letter from manchester city council is a strong contender for facepalm of the year,FAKE
hillary clinton accused of stealing furniture from the state department,FAKE
the corbett report accept no substitutes,FAKE
hacking democracy creator just exposed how hillary has already rigged 99 of voting machines  ,FAKE
round up the unusual suspects moneyball nerds squeeze out blacks  latinos from baseball jobs,FAKE
aide said he was running bill clinton inc in new wikileaks dump,FAKE
how hedonistic game became the gateway to virtuous truths,FAKE
donald trump and the equilibrium to come  new eastern outlook,FAKE
trumped after deceiving the american people the new york times vows to start reporting honestly,FAKE
trump voter listens carefully to call for national unity then sets up aryan website,FAKE
punishment is violent and counterproductive,FAKE
north korea threatens sacred nuclear war against israel if this country continue supporting isis,FAKE
civil war in the gop trump leading long experiment in populism new republican party,FAKE
comment on im the law today nga  cop fired after using social media to declare her racism by albert wesker,FAKE
game changer trump supporter charged in voter fraud case,FAKE
tomgram nomi prins too big to fail hillary style,FAKE
europe or russia could moldovas presidential election determine its future,FAKE
aspartame turns into formaldehyde and methanol in the body donald rumsfeld got it legalized,FAKE
north dakota had 292 oil spills in 2 years officially disclosed 1 to the public,FAKE
trump wants to appoint alt right propagandist steve bannon as his chief of staff,FAKE
get ready for civil unrest survey finds that most americans are concerned about election violence  redflag news,FAKE
a tea party congressman just called for armed uprising if trump loses,FAKE
hillary clintons elections 2016 concession speech from new york full streamed live,FAKE
scientists find 19 pieces of non human dna in the human genome,FAKE
she drank carrot juice every day for 8 months and got rid of cancer,FAKE
jerusalem in photos from 1862 no mosques no palestinians   only ghost towns of massacred christian areas,FAKE
