title,label
going back to the future in 2016,REAL
dem insiders sanders failed to dent clinton,REAL
fuming over ryan some conservative voices turn on the freedom caucus,REAL
cruz trump and rubio win in iowa and now we know who the losers are too,REAL
trump will skip gop debate as feud with fox news boils over,REAL
trump to african americans what do you have to lose,REAL
clinton foundation received subpoena from state department investigators,REAL
house gop smells victory in budget battle,REAL
why the gop could take obamas corporate tax proposal seriously,REAL
manhunt for escaped killers expands to vermont,REAL
patriot act debate highlights stark differences between 2001 2015 views,REAL
the cleveland show convention starts under security cloud,REAL
texas troopers to ask drivers their race following investigation,REAL
rand paul wraps filibuster over patriot act and nsa surveillance,REAL
poll clinton support spikes following democratic convention,REAL
rand pauls all too familiar campaign,REAL
kate steinles death and sanctuary cities what good are our laws without enforcement,REAL
is the gops stop trump campaign too late,REAL
gary johnson avoids typical third party fade best polling since perot in 92,REAL
one year after obama embraced cuba what has changed,REAL
popular health exchange in jeopardy after surprise republican win,REAL
marco rubios strategy is utterly baffling,REAL
did gary johnson just get boxed out of the debates,REAL
david sweat shot captured alive after new york manhunt,REAL
inside the war on coal,REAL
scott walkers economic mess how worker wages were gutted in wisconsin,REAL
democrats weigh how to nudge sanders out,REAL
eleven states sue obama admin over transgender directive,REAL
sanders warns clinton against moderate as vp,REAL
evangelicals sing a new tune on trump meeting may be a tipping point,REAL
donald trump im not flip flopping on immigration,REAL
ryan and mcconnell confront their first big test,REAL
will asia trade deal hurt us workers six tough questions answered,REAL
facebook isnt just making us less partisan its making us less politically engaged,REAL
gas prices could drop toward 1 a gallon,REAL
adelsons review journal gives trump first major endorsement,REAL
jeb bush and iraq what price family loyalty video,REAL
obama oval office speech aims to reassure nation over terror threats,REAL
gop contenders prep for loud ugly holiday season,REAL
trump in vegas phoenix illegals wreaking havoc on our population,REAL
pope calls on catholics to shelter europes migrants,REAL
jonah goldberg hillarys iowa win is a big loss for democrats,REAL
guns terror and lgbt rights orlando shooting raises stakes for next president,REAL
media trumpeting trump implosion but is it real,REAL
us economy added 223000 jobs in april,REAL
the collectivist election,REAL
whats behind the debate over the republican debates,REAL
pure chaos donald trumps campaign management offers a glimpse into his governing style spoiler alert its terrible,REAL
sorry america but trump can actually win,REAL
how far can campaigns go to win support from a republican delegate,REAL
clintons lead has evaporated in nevada and her supporters are panicking,REAL
united states v texas the biggest immigration case in a century explained,REAL
indiana law sorting fact from fiction from politics,REAL
workplace violence or terrorism ca massacre probe unfolds,REAL
anti trump delegates now responsible for nominating him,REAL
in rush to reclaim yemen exiled leaders risk fracturing it,REAL
why mitch mcconnell bid to extend patriot act failed,REAL
the daily 202 why blocking obamas pick to replace scalia could cost republicans their senate majority,REAL
state department admits to deliberately cutting briefing footage on iran deal,REAL
nikki haley should have run for president,REAL
nj gov christie walks a fine line on gay marriage,REAL
chris christie losing home state donors as jeb bush makes inroads,REAL
cruz wins cpac presidential straw poll,REAL
senate debate reveals absurd level of trade deal secrecy,REAL
gop searches for obamacare fix,REAL
why america might elect a president it doesnt like,REAL
how the battle against the islamic state is redrawing the map of the middle east,REAL
will any of obamas isis proposals succeed,REAL
carly fiorina announces presidential bid,REAL
why the drop in income inequality,REAL
state department says netanyahu twisted kerrys words in speech to congress,REAL
future obamacare costs keep falling,REAL
obama pushes controversial trade deal in germany,REAL
why scott walkers supernova campaign burned out video,REAL
san bernardino massacre a horror that affects us all,REAL
what advantages does marco rubio have,REAL
this is how ted cruz wins why the formerly unthinkable could really actually happen,REAL
100000 people have come to recent bernie sanders rallies how does he do it,REAL
south korean naval vessel fires warning shots near north korean patrol amid high tension,REAL
how trump is following in sanderss fundraising footsteps video,REAL
clinton and the dnc a crisis not merely survived but transcended,REAL
2016ers hail release of us prisoners held by iran as republicans slam obama policy,REAL
clinton cries racism tagging trump with kkk trump says she lies,REAL
how rich candidates try to appeal to working voters,REAL
trump and what he might say next is burning up gops political capital in washington,REAL
why does isis keep making enemies,REAL
how common core quietly won the war,REAL
what makes america exceptional clinton and trump trade places video,REAL
abortion gaffes show trump is the left wing caricature of a conservative,REAL
to get around congress obama turns to city halls,REAL
surviving escaped prisoner likely fatigued and prone to mistakes police say,REAL
oklahoma fraternity is closed over video of racist chant,REAL
nearly 300k new jobs in february unemployment dips to 55 percent,REAL
is gop ready to unite against trump for his muslim ban,REAL
doug schoen trump hillary and the forgotten swing vote    seniors,REAL
mcconnell announces plan b to stop iran deal,REAL
iran world powers agree to nuclear deal,REAL
yes ted cruz could win,REAL
will hillary clinton lose the election because of the fbi email investigation,REAL
city county leaders ask court to lift injunction on obama immigration programs,REAL
hillarys no slam dunk in 2016,REAL
for first time trump shrinks in spotlight fiorina steals show,REAL
is jeb bush conservative enough,REAL
in a revealing interview trump predicts a massive recession but intends to eliminate the national debt in 8 years,REAL
parts of patriot act expire even as senate moves on bill limiting surveillance,REAL
the weeds our undemocratic primaries obamas new fiduciary rule and the challenge of information polarization,REAL
non confrontational style social media aiding ben carsons surge in polls,REAL
antiquities destroyed at palmyra by the islamic state,REAL
monica lewinskys latest comeback fueled by media remorse,REAL
seeking refuge five lessons from europes migration crisis,REAL
the daily 202 the presidency is hillary clintons to lose here are 12 ways she could lose it,REAL
senate blocks bill to end government collection of phone records,REAL
blaming the media for trump why that utterly misses a political upheaval,REAL
2nd new york prison worker charged in killers escape,REAL
juan williams my bets on trump clinton vice presidential picks,REAL
what i learned watching 15 hours of cruz family videos,REAL
anti semitism growing in europe,REAL
jeb 2016 the bush battle within,REAL
joe biden in 1992 no nominations to the supreme court in an election year,REAL
obamacare enrollees anxiously await supreme court decision that threatens their coverage,REAL
super tuesday ii clinton sweeps florida illinois ohio and north carolina rubio quits after trump wins florida,REAL
boehner baffled by israeli spying report,REAL
clintons health continues to spur controversy and conspiracy,REAL
kevin mccarthy announces hes a candidate for house speaker video,REAL
trump calls for the return of waterboarding by us,REAL
your election night survival guide what to expect as polls close,REAL
the daily 202 ted cruzs war with matt drudge could become a huge problem for his campaign,REAL
clinton camp in damage control mode over top secret emails,REAL
will clintons experience be a liability,REAL
gop field rips obamas move toward executive action to tighten gun control laws,REAL
cruz crushes trump in wyoming republican caucus,REAL
basket of deplorables for once hillary told the truth about what she really thinks,REAL
why hillary clinton not bernie sanders won town hall,REAL
trump ups the ante in indiana,REAL
exclusive gop campaigns plot revolt against rnc,REAL
state dept admits official censored sensitive iran nuclear deal video,REAL
brothers idd as suicide bombers in belgium,REAL
will the gop mount a third party challenge to trump,REAL
how public funding of elections makes politics even more polarized,REAL
fiorina rejects idea of affirmative action in cnn debate change,REAL
the supreme court cannot hide on obamacare,REAL
drudge koch soros bezos these 4 non politicians will determine the next president,REAL
trudeau elected canadas prime minister as liberals assume power,REAL
claire mccaskill accuses marco rubio of shirking principles on immigration,REAL
trump slams gop nominating process as top aide accuses cruz of gestapo tactics to win delegates,REAL
paul ryan says government wont shut down because republicans are in control,REAL
dan pfeiffer to leave white house,REAL
bush rubio and kasich eye one another in the shadow of trump,REAL
kevin mccarthy is a total dope this bumbling yahoo is about to be second in line to the presidency,REAL
how republicans are targeting clinton on foreign policy,REAL
raise the wage paul krugman shatters the myth that we cant afford to boost workers pay,REAL
trump cuts off fundraising events for republican party,REAL
elizabeth warren declares herself ready to be hillary clintons running mate,REAL
sanders trump easily win west virginia primary trump picks up nebraska too,REAL
the blame the left crew what the rights new hebdo attack is really about,REAL
senators pledge to amend house bill after some nsa powers halted,REAL
after tragic shooting charleston church reopens with prayer songs and tears,REAL
rural america confronts a new class divide,REAL
ky clerk says wont personally authorize gay marriage licenses    or interfere,REAL
democratic debate 6 takeaways,REAL
rick perry drops out of 2016 presidential race,REAL
exclusive new jeb bush super pac ad uses paris san bernardino images,REAL
exclusive more than 100 lawsuits disputes over taxes tied to trump and his companies,REAL
heres how many people in each state may not be able to afford insurance if the supreme court rules against obamacare,REAL
fight night in las vegas high stakes for trump clinton and chris wallace,REAL
jeb bush invokes mlk as he unveils education plan,REAL
poll hillary clinton tops donald trump gop field on handling terror,REAL
how obama abandoned democracy in iraq,REAL
trump smirks as beltway gop crumbles,REAL
president obama wants to disarm america,REAL
what draw muhammad shootings say about islamic state reach video,REAL
ryan hopes for new tone in trump campaign,REAL
gop presidential candidates hammer on top secret clinton emails in final days before iowa caucus,REAL
how will facebook google and twitter define the hate they plan to censor,REAL
gaming obamacare,REAL
as clinton builds on a strong debate trump lobs attacks and complaints,REAL
poll 71 percent of dems think clinton should keep running even if indicted,REAL
as rubio stumbles race for second place tightens in new hampshire video,REAL
former facebook staffers say conservative news is deliberately suppressed,REAL
copenhagen police shoot kill man near train station,REAL
in france a growing debate over why some speech is protected and some isnt,REAL
the supreme court is just as polarized as the rest of us politics   and this may have profound implications,REAL
john kerry isis responsible for genocide,REAL
3 explanations for why donald trump is suddenly doing better in the polls,REAL
hillary clinton bernie sanders kings legacy is alive,REAL
bush slashes campaign budget refocuses on key primary states,REAL
police arrest 12 suspected of helping paris gunmen,REAL
house republicans try to gut a key american principle,REAL
trump wins presidency defeats clinton in historic election upset,REAL
climate change what you can do opinion,REAL
who lost iraq,REAL
in the houses dark hour speaker paul ryan offers a glimpse of hope,REAL
why the obamacare doomsday cult cant admit its wrong,REAL
to nominate clinton it takes a village,REAL
clinton struggles to contain media barrage on foreign cash,REAL
historic firsts fill evening at democratic national convention,REAL
these political scientists may have just discovered why us politics are a disaster,REAL
kerry to go to paris in gesture of sympathy,REAL
sanders draws early support for white house bid from long time union allies,REAL
on more than one issue gops trump sounds like a democrat,REAL
3 winners and 2 losers from sunday nights democratic presidential debate,REAL
donald trump cant stop saying nasty things about women it could cost him,REAL
hillarys leftward sprint cheers dems,REAL
donald trump to trek us mexico border thursday,REAL
how to watch tonights republican debate,REAL
there is such a thing as being too late obama issues a desperate call for a global climate deal,REAL
chattanooga shooting history of attacks on us military,REAL
americas racial generation gap takes an ugly political turn,REAL
liberal media mocks republican presidential candidates with clown car diss,REAL
rubios parting shot at trump,REAL
top takeaways from the miami republican debate,REAL
clinton clinches democratic nomination   sanders vows to fight on,REAL
anti trump forces seek last ditch delegate revolt,REAL
iran carries out new ballistic missile test,REAL
conservative watchdog group accuses democrats of illegally coordinating through voter data firm,REAL
house republicans seek obamacare repeal more defense  in new budget plan,REAL
in rand paul and marco rubios feud over cuba policy a preview of gops 2016 foreign policy debate,REAL
ben carson slams reporters over questions about his past,REAL
trumka disappointment with obama a warning for hillary,REAL
hhs announces small extension for obamacare sign up bigger delay next year,REAL
kentucky election could blot an obamacare bright spot,REAL
france belgium move to tighten security fbi said to warn of threat in italy,REAL
tax calculator the federal debt,REAL
trump claims gop nomination tells struggling americans i am your voice,REAL
obama warren absolutely wrong on trade deal,REAL
the 10 most bald faced lies from the final republican debate of 2015,REAL
starbucks baristas stop writing race together on cups,REAL
democrats see chance to reshape map as trump stumbles,REAL
liberals poised to give obama a win on iran,REAL
after stumbles trump seeks to avert damaging loss in wisconsin,REAL
appeals court rules against obamas immigration plan,REAL
george w bush reportedly rips ted cruz to jeb bush donors,REAL
the 2016 ballot wars begin,REAL
chris christie landslide template for a republican presidential win in 2016 video,REAL
millennials are more racist than they think,REAL
trump and sanders win we are witnessing a full scale revolt america,REAL
homeland security chief says 30000 will be furloughed if department shuts down,REAL
mike huckabee on netanyahu wage stagnation 2016 and more,REAL
first charlie hebdo issue since attack sells out,REAL
kasich my republican party doesnt like ideas,REAL
biden backers to naysayers not so fast,REAL
the case for a clinton warren ticket,REAL
how the confidence deficit is impacting the 2016 election,REAL
the religious rights no 1 enemy what pope francis recognition of palestine really means,REAL
trumps sweep is another humiliating defeat for media and political elites,REAL
obamas long view foreign policy why he thinks the us can bend the arc of history,REAL
this astonishing chart shows how moderate republicans are an endangered species,REAL
obama paris terror rampage a setback,REAL
hillary clinton to announce presidential bid on sunday,REAL
pope francis address to congress what it means for six catholic lawmakers video,REAL
poll finds ben carson knocks donald trump from top spot nationally,REAL
netanyahu steps back from full opposition to palestinian state,REAL
ted cruz protester would get spanking at my house,REAL
is it time to reconsider lifetime appointments to the supreme court,REAL
how the obama white house runs foreign policy,REAL
sarah palin endorses donald trumps presidential bid,REAL
clintons challenge will be to balance a hopeful tone with an argument for change,REAL
prisoner in van heard banging against walls,REAL
how clintons email scandal took root,REAL
obama says terrorists seek legitimacy by using religious tie,REAL
kerry tells capitol hill critics of iran nuclear deal to hold their fire until final deal,REAL
poll gives biden edge over clinton against gop candidates vp meets with trumka,REAL
police morale can wait how the baltimore riots should reshape attorney general loretta lynchs agenda,REAL
missing on gop debate stage a future president opinion,REAL
its getting harder every day rubio says of possible trump support,REAL
clinton calls for common sense gun control after charleston terrorist attack,REAL
the immigration swamp,REAL
walgreens to close 200 stores boost cost cutting,REAL
life among the berned,REAL
ruth bader ginsburg regrets ill advised remarks about donald trump,REAL
alabamas top judge faces ethics charges over gay marriage order,REAL
how ryan decided to ditch trump,REAL
wall street flies higher for second day of gains,REAL
jills dilemma,REAL
the ultimate triumph president trump,REAL
harry reid endorses chuck schumer to succeed him as senate democratic leader,REAL
does the road to the white house run through gary johnsons new mexico,REAL
msnbcs year of standing up straight,REAL
why netanyahu victory isnt likely to make us israel relations worse video,REAL
megyn kelly special trump defends tone says bid will be complete waste if he doesnt win,REAL
supreme courts political stench why john roberts will obviously base his obamacare decision on politics,REAL
vfw fires back at obama politics not confused,REAL
trump on twitter hillary is brainwashed,REAL
john kerry says its unclear whether iran deal is within reach,REAL
no brotherly love in philly email scandal threatens to mar dnc,REAL
obama passes baton to clinton stirs up 3rd term charges,REAL
super tuesday brings harsh light and heartaches on the morning after,REAL
im glad that he won the surprising palestinian reaction to netanyahus win,REAL
biden says ukrainians have a right to defend themselves mum on us sending weapons,REAL
kasich tells indiana voters to support him despite pledge not to campaign,REAL
where donald trump and hillary clinton stand on economic issues,REAL
obama to name marine gen dunford chairman of joint chiefs of staff,REAL
donald trump i want surveillance of certain mosques,REAL
the republicans red scare,REAL
how last nights gary johnsonwilliam weld cnn town hall was a disappointment in libertarian terms,REAL
canada just threw a grenade into elizabeth warrens trade fight with obama,REAL
even under oath trump struggled with the truth,REAL
clinton is close but sanders not ready to give up,REAL
report obama administration makes no progress on drone program transparency,REAL
in era of trump spin cycle gets a makeover,REAL
house votes to block obamas immigration actions  but exposes new gop divisions,REAL
clinton puts trump on defense at first debate,REAL
france launches fierce assault on isis targets in syria,REAL
this astonishing chart shows how moderate republicans are an endangered species,REAL
rubio my pro family pro growth tax reform plan for the 21st century,REAL
bernies california endgame,REAL
state parties can reduce polarization and improve the political system  institution,REAL
with common core tests a lot at stake for first year principal,REAL
kentucky clerks office issues same sex marriage license,REAL
cruz eyes insurance via obamacare a law he vows to scrap video,REAL
why the way we pick our vps is terrible,REAL
ryan so far proves he can make the sausage but hell likely be serving a much different house party in 2016,REAL
exclusive hillary may delay campaign,REAL
its not the locker room talk its the lock her up talk,REAL
climate change crusade goes local,REAL
so that happened did obama forget that the gop runs congress,REAL
biden probably wont beat clinton he should run anyway,REAL
iran nuclear talks what if the deal falls through,REAL
trump clinton cautiously optimistic ahead of iowa caucuses,REAL
obama plans to press ahead with guantanamo bay closure,REAL
congress moves to kill union election rules setting up new obama veto,REAL
gop candidates set aside insults,REAL
swing state stunner trump has edge in key states,REAL
bernie sanders blames closed primaries as path to the nomination narrows,REAL
with another deadline looming whispers of iran nuclear deal emerge,REAL
barack obama president oh bummer,REAL
anti muhammad cartoon contest free speech or deliberately provocative video,REAL
obamas last state of the union address in three words disjointed irrelevant and disappointing,REAL
why long shots and also rans run for president its the media stupid,REAL
bernie sanders party crasher notes on the looming end of a campaign,REAL
in baltimores call for federal police probe a new search for answers video,REAL
fidel castro makes rare public appearance in cuba,REAL
get ready for a fight to replace scalia,REAL
alabama begins issuing marriage licenses to gay couples,REAL
boston bombing trial plea deal fails,REAL
donald trump is running out of ways to win,REAL
obama for all the things republicans blame me for getting blamed for rise of donald trump is novel,REAL
obama hits the trail for hillary clinton will he help or hurt,REAL
what will republicans do when they take full control of congress,REAL
obamas terror strategy is failing us must heed lessons of 911,REAL
in jamaica obama indicates that he will remove cuba from terrorism list,REAL
4 things the new hampshire primary will tell us,REAL
megyn kelly interrogates tom cotton on iran letter whats the point in writing to the iranian mullahs,REAL
hillary clinton the criminal investigation keeps moving forward,REAL
5 takeaways from the debate that didnt matter,REAL
sanders says hes backing dnc chairs primary opponent,REAL
carly fiorina ted cruz says whatever to get elected,REAL
will islamic state attacks bolster prospects for political solution in syria video,REAL
trove of bin laden documents released,REAL
obama guarantees he will not interfere with clinton email investigation,REAL
live from new hampshire theyre all here,REAL
the gop still has nothing to show for its anti planned parenthood campaign,REAL
what i learned from speaking to an rnc attendee from every state,REAL
sure we want an honest and trustworthy president but its complicated,REAL
interior no more new arctic oil leases for remainder of obamas presidency,REAL
can paul ryan and donald trump coexist within the republican party,REAL
israel stole classified us information and used it to help congressional republicans,REAL
time is running out for bernie sanders,REAL
what happened to carly fiorinas presidential hopes video,REAL
voters dilemma what happens if its hillary vs trump,REAL
a combative donald trump shows up at tampa and pittsburgh rallies,REAL
some gop elites arent quite convinced by trump charm offensive,REAL
obama we will be as aggressive as we can on immigration appeal,REAL
how millennial voters see this election,REAL
insiders marco rubio crashed and burned,REAL
how to win the presidency with 23 percent of the popular vote,REAL
belgian police hunting 2 mystery bombers believed to have survived brussels attacks,REAL
gov kasich enters gop white house race touting skills and experience,REAL
campaign finance laws may be making political polarization worse by encouraging purist donors,REAL
lynch faces congress in attorney general hearing,REAL
reporter says clinton camp denying him access to events,REAL
the problems with facebooks polarization study,REAL
netanyahu defeats center left rival in israels parliamentary election,REAL
ernst to trump stop with the name calling,REAL
netanyahu blasts very very bad iran nuclear agreement,REAL
overdue change in overtime pay our view,REAL
sanders campaign sues dnc after database breach,REAL
fate of paris attack mastermind unclear after raid but intel sources reportedly say hes dead,REAL
four ways to fix american politics,REAL
kerry assad must go,REAL
education secretary arne duncan stepping down,REAL
whos winning indiana its anybodys guess,REAL
obama inches closer to veto proof support for iran nuclear deal,REAL
debate night the media want a trump fight with blood and bruises,REAL
house gop obsessed with boehners future,REAL
the collapse of rand paul and the libertarian moment that never was,REAL
five takeaways from the gop debate,REAL
obama awol in paris message to america allies is we dont care,REAL
rubio surges back to electrify south carolina,REAL
to finish mlks work face up to racism opinion,REAL
obamas inconsistent claim on the frequency of mass shootings in the us compared to other countries,REAL
ted cruz drops out of the 2016 presidential race,REAL
charles krauthammer obama charlie who,REAL
flint michigan neglected because city is black poor,REAL
a whirlwind day in dc showcases trumps unorthodox views and shifting tone,REAL
supreme court races the clock on gay marriage obamacare and more,REAL
poll 6 in 10 back renewal of nsa data collection,REAL
surprised about donald trumps popularity you shouldnt be,REAL
fact checker takes obama to task for gun claims,REAL
state dept accused of stiff arming intel watchdog over hillary emails,REAL
