title,label
this is only the beginning nate silver explains how donald trump has hacked the system and created a roadmap for future political con men,REAL
feds arrest two women in new york city in alleged terror plot,REAL
3 reasons americans die sooner than people in other developed nations guns drugs cars,REAL
the new argument against gay equality same sex marriage kills,REAL
rubio goes from robot to terminator against donald trump,REAL
iran nuclear agreement is a better deal possible   and at what cost video,REAL
egyptian planes pound isis in libya in revenge for mass beheadings of christians,REAL
the last days of washington dc america can no longer mask its steep decline,REAL
dr manny water crisis in flint is just the tip of the iceberg,REAL
ted cruz victory shows gops impossible conundrum video,REAL
sanders republican governors eye comeback in new hampshire primary,REAL
how gary johnsons vote percentages will affect libertarian party ballot access state by state,REAL
gop candidates jockey for position in final debate dash,REAL
parsing bidens words if hillary runs he wont   politicscom,REAL
mr trump goes to washington the surreal spectacle of a know nothing gop frontrunner,REAL
the oregon militia standoff explained,REAL
final votes on patriot act trade deal bill set dramatic stage for congress return,REAL
billionaires fund anti trump delegate push,REAL
see which 2016 candidates best align with your views,REAL
families to roof i forgive you and have mercy on your soul,REAL
nato and putin downed russian bomber is big threat,REAL
how trump overshadowed clintons bad weekend,REAL
debate goals for the democratic candidates,REAL
marines killer set off no red flags,REAL
walmart gives 500000 workers a raise,REAL
rnc chairman were going to embrace whoever the nominee is,REAL
republicans in state governments plan juggernaut of conservative legislation,REAL
buffett if i ran fed i would not raise rates significantly,REAL
hillary clinton explains why she wont say radical islam,REAL
the iran deal and the cost of political polarization  realclearpolitics,REAL
loretta lynch joins obama in prodding senate over nsa,REAL
clinton sanders accuse trump of inciting violence,REAL
race to replace boehner expected to be another leadership vs conservative caucus showdown,REAL
clinton and sanders neck and neck in california primary,REAL
white house nyt leave bushes out of lead photos from selma march,REAL
the new surgeon generals 4 rules for health,REAL
rating obama 50 say hes been a success,REAL
done deal clinton trump shift to general election after big wins,REAL
wingnuts have a death grip on congress why paul ryan cant control the house gop,REAL
5 key questions about shutting down gitmo,REAL
gop hits back at fracking rules,REAL
is it possible to fix the polarization of american politics,REAL
why the ted cruz marco rubio debate mattered most video,REAL
all three republican presidential candidates back away from pledge to support eventual nominee,REAL
this is what its like to be a bush stuck at the bottom of the polls,REAL
defense secretary carter endorses 3 year timeline in obama anti isis plan backs off criticism,REAL
poll hillary clinton ahead in 5 potential match ups   politicscom,REAL
why you should be skeptical of wacky new studies about what sways elections,REAL
the oregon standoff and americas double standards on race and religion,REAL
us secretly tracked billions of calls for decades,REAL
democratic debate fact checking the candidates,REAL
obama administration announces halt on new coal leases,REAL
the gop front runner its not jeb bush,REAL
ted cruz says only he can beat donald trump,REAL
dems open convention without wasserman schultz,REAL
the scariest thing about brussels is our reaction to it  simon jenkins,REAL
gop debate no one trumps trump and six other takeaways from las vegas,REAL
los angeles times backs clinton over sanders,REAL
yosemite free climbers reach top of el capitan,REAL
suspected terrorist attack on a free speech event in copenhagen leaves one dead,REAL
donald trump throws a grand old party,REAL
immigration crackdown splits gop,REAL
laura bush hints shed rather see hillary as president,REAL
how congress finally killed no child left behind,REAL
sen kirsten gillibrand says supreme court decision on marriage equality just the beginning,REAL
yes there is a clinton double standard,REAL
new york times endorses hillary clinton john kasich for nominations,REAL
glenn reynolds dont be a sucker for socialism,REAL
the gop farce plods along why last nights interminable debate was an affront to the partys patron saint,REAL
white house willing to sign compromise iran bill,REAL
isis activity prompts threat level increase at bases,REAL
cruz says fate of homeland security in gop leaderships hands,REAL
rand paul goes on senate floor to protest nsa spying measure,REAL
kasich bows out did he do the right thing,REAL
calif ore allow women to get birth control without a prescription,REAL
obamas trade agenda clears key senate hurdle,REAL
employers added a disappointing 126000 jobs in march,REAL
how ted cruz outfoxed donald trump in iowa,REAL
cuba releases all 53 political prisoners to complete deal us official says,REAL
john boehners parting gift to paul ryan,REAL
excruciating choice for gop leaders take a risk on trump,REAL
climate change deniers are in retreat,REAL
the libertarian moment is so over that libertarians are now the single largest group gallup,REAL
rick santorum hopes 99 county iowa tour leads to success,REAL
how the gop can take back the white house,REAL
how paul ryan and mitch mcconnell took such different approaches to supporting donald trump,REAL
bill clinton suggests trump slogan racist   but he used the same one,REAL
tom cotton calls for global military dominance in maiden senate speech,REAL
strong jobs number holds risks for clinton,REAL
bernie sanders has strength among white men pinched by the economy,REAL
jeb seeks to shake shadow of bush family name,REAL
donald trump we have to take back the heart of our country,REAL
american sniper widow gun control wont protect us,REAL
democrats clinton and sanders pounce on flint water crisis  and each other,REAL
the 2016 election in 5 easy charts,REAL
kasich bushs campaign is freaking out,REAL
does blood on shoe link suspect to washington slayings,REAL
hillary clinton raised 45 million in latest quarter,REAL
netanyahu i wont allow israel to be submerged by refugees,REAL
clintons 2016 makeover the latest in long line of resets,REAL
housing in 2015 four reasons for optimism and one for worry,REAL
obama nominates merrick garland to supreme court sets up senate showdown,REAL
freed al qaeda operative floated as part of prisoner swap ex diplomat says,REAL
dont underestimate rand paul as a 2016 presidential contender,REAL
trumps campaign is damaging his brand,REAL
us economy added 271000 jobs in october beating expectations,REAL
could this be the real super tuesday a look at whats at stake,REAL
one of this elections bright spots early voting,REAL
republican conventions non conventional list model astronaut and trump clan,REAL
bernie sanders says private meeting with pope francis is not an endorsement,REAL
boehner allies downplay gop rifts,REAL
can huckabee overcome the new car smell of other candidates,REAL
us military commander russian military far more capable than soviet unions,REAL
hillary clinton unpatriotic donald trumps praise of putin is scary,REAL
would trump presidency threaten rule of law,REAL
poll clinton leads trump by three points,REAL
long shot candidates look to keep hope alive for 2016,REAL
barack obama says memory of hiroshima must never fade,REAL
the presidential bid of ted cruz the reddest meat of the right,REAL
7 takeaways from the republican debate,REAL
theres nothing suspicious about trumps accusers coming forward weeks before the election,REAL
prison employee pleaded not guilty to aiding escape of two murderers,REAL
obama bans some military equipment sales to police,REAL
dnc chair wont run for senate in 2016,REAL
new snowstorm new target south under siege,REAL
what advantages does scott walker offer,REAL
stossel why marco rubio and hillary clinton are 2016s likely nominees,REAL
the surprising voting rights issue both democrats and republicans support,REAL
republicans warn iran against nuclear deal with obama,REAL
laura ingraham the trump betrayal by republican elites wont soon be forgotten,REAL
pope francis arrives in new york city for second stop on us trip,REAL
trump and advisers remain split on how far to move toward the middle,REAL
republicans finally pass an obamacare repeal do gop voters care,REAL
isis suspected in russia crash what it means,REAL
why californias drought hasnt sent food prices soaring,REAL
democrats push to prevent gun sales to terror list suspects,REAL
ted cruz now the odds on favorite,REAL
doj guardsman cousin charged with supporting isil,REAL
initial prognosis poor for obamas immigration program at supreme court,REAL
hillarys policies wheres the beef,REAL
hillary clintons basket of deplorables explained,REAL
matt bevin is the next governor of kentucky he has president obama to thank,REAL
russian plane crash in sinai all 224 on board killed,REAL
state department warns of possible terror attack in south africa,REAL
trumps unraveling republican party how we reached this point,REAL
as clinton moves to brink of nomination sanders eyes california upset,REAL
white house makes formal veto threat against keystone aca bills,REAL
sanders gets the fight he wanted,REAL
death of saudi king abdullah brings uncertain new era for us in middle east,REAL
clintons super pac fundraising irks progressives,REAL
senate race rankings dems attack as gop lays swing state groundwork,REAL
rubio looks to april 13 miami launch,REAL
john kasichs advice for women to prevent sexual assault avoid parties where theres a lot of alcohol,REAL
liberal pundits blame debbie wasserman schultz not bernie sanders for democrats division,REAL
supreme court throws out conviction for violent facebook postings,REAL
christie is wrong vaccination is not a personal decision its a social obligation,REAL
speakers list trumps convention has pols and celebs,REAL
lots of candidates want to simplify tax code heres what they get wrong,REAL
the iowa caucuses are closer than you think,REAL
new isis video shows paris attackers committing prior atrocities threatening uk,REAL
who will hillary clintons basket of deplorables comment actually alienate,REAL
clinton is banking on the obama coalition to win,REAL
trumps challenges come to the fore reshaping gop race,REAL
thousands march to mourn slain boris nemtsov,REAL
white house monitoring iran aid ship to yemen,REAL
federal court nsa phone record collection is excessive,REAL
trump would be least popular major party nominee in modern times,REAL
whos got the best chance against clinton its not who you think,REAL
will the comey bombshell really shake up the 2016 race,REAL
jeb bush fights lonely battle defending common core,REAL
im a black ex cop and this is the real truth about race and policing,REAL
opec sees oil prices exploding to 200 a barrel,REAL
long odds ahead for obama on his troubled trade agenda,REAL
gary johnson cant name a single foreign leader can we stop pretending hes a real alternative now,REAL
cruz takes all 14 delegates at wyoming gop convention ny primary next,REAL
sanders clinton talk immigration battle for hispanic vote before big california primary,REAL
orlando the mainstream media serves up a false narrative about terror attack,REAL
why pundits politicians and the press hate ted cruz,REAL
reid wont seek re election,REAL
iran agrees to nuclear restrictions in framework deal with world powers,REAL
trump vows to win im not going anywhere,REAL
trumps hitlerian disregard for the truth,REAL
netanyahu poised for third straight term as israel pm after chief rival concedes,REAL
germanys merkel backs tighter refugee rules amid sex assault protests,REAL
new senate majority leaders main goal for gop dont be scary,REAL
turkey russia headed for a military face off,REAL
clinton emails on trade deal held until after election   video,REAL
doubts rise over report freddie gray injured himself,REAL
white house warns congress fight zika or live to regret it,REAL
senate panel votes tuesday on iran bill that gives congress say on nuclear deal,REAL
cruzs immigration gambit,REAL
libertarians hope rallies and ads can nudge them into the presidential debates,REAL
obamas big new resolution on isis is really about limiting presidential power,REAL
clinton broadens campaign effort to target wary republicans,REAL
cruz is as bad as trump and maybe worse column,REAL
clinton ekes out win in iowa against sanders,REAL
washpost poll clinton leads trump by 4,REAL
sorry jeb anchor babies is a slur,REAL
after brussels trumps strength resonates with gop voters video,REAL
sabotaging common core,REAL
supreme court trump engulf capitol hill,REAL
suspect who worked for wealthy dc family arrested for their deaths,REAL
bernie sanders is expected to endorse hillary clinton today what did his movement mean,REAL
john mccain withdraws support of donald trump,REAL
phyllis schlafly campus sex assault is on the rise because too many women go to college,REAL
iraqi forces civilians flee as isis gains control of ramadi us official says,REAL
why hillary clinton wins even when she loses,REAL
obama spends earth day in the everglades taunting republicans on climate change,REAL
clinton picks up the first major labor endorsement of 2016,REAL
7 takeaways from the first democratic debate,REAL
election 2016 rand paul poised to launch campaign,REAL
the man who will not bow to fearmongering,REAL
how women lead differently,REAL
trumps economic team has a lot of billionaires very few economic experts,REAL
poll obama popularity on the upswing,REAL
ronald reagan made it all worse how republicans  the real party with their hands out  convinced white america that government was out to get them,REAL
us faces calls to walk away from iran talks,REAL
mccarthy bombshell leaves house gop in chaos,REAL
trump slams corrupt media as more women make sexual assault claims,REAL
louie gohmert for house speaker,REAL
inside the deliberations of a hillary clinton campaign launch,REAL
clinton has delegates to win dem nomination ap reports sanders questions tally,REAL
combat veterans face cruel struggle to prove their service to va amid missing records,REAL
huckabee appearing at trump event in iowa,REAL
even exxonmobil says climate change is real so why wont the gop,REAL
bernie sanders digs in,REAL
supermajority of house freedom caucus to back paul ryans speaker bid,REAL
can cruz kasich strategy really stop trump,REAL
a case study on why the obamacare lawsuit is based on mythical history,REAL
is the hillary email scandal watergate all over again,REAL
presidential transition of power begins amid nationwide protests,REAL
netanyahu enters never never land,REAL
the gops establishment candidates begin aiming at each other,REAL
us economy added a robust 292000 jobs in december,REAL
extreme weather to cause extreme food shortages task force finds,REAL
after obama changes tack on syria what would the presidential candidates do,REAL
lynchs delayed confirmation vote,REAL
steve case why im voting for hillary clinton,REAL
walmart is a cultural sickness how the american workplace is enriching the wealthy  and destroying everyone else,REAL
standoff between obama netanyahu deepens despite palestinian state clarification,REAL
egyptair crash official dismisses claim that remains suggest blast,REAL
100 years ago 15 million armenians were systematically killed today its still not a genocide,REAL
donald trump stands by jeb bush george w bush 911 comments,REAL
trump surges in battleground national polls,REAL
historic nuclear deal reached in vienna what does it mean for iran,REAL
donald trump doesnt want to make america great he wants to make it afraid,REAL
a gop weekend courtesy of the koch network and citizens united,REAL
an open letter to donald trump from ari fleischer five things you need to do now,REAL
have there been 353 mass shootings this year  or just 4,REAL
bush v trump behind the vegas rumble,REAL
is gop establishment learning to like donald trump video,REAL
why hillary clinton is unlikely to be indicted over her private email server,REAL
obama vetoes gop attempt to repeal obamacare,REAL
why riots happen in places like baltimore,REAL
5 things to know about mike pence before tuesdays debate,REAL
nevada politics expert trump is dead in the state,REAL
quality care for vets more important than wait times says va secretary,REAL
what liberals could learn from ted cruzs flat tax,REAL
how bernie sanders beat the polls and won indiana,REAL
why donald trump is beating fox news    and gop rivals,REAL
conspiracy theories swirl around the death of antonin scalia,REAL
dana perino conservatives here are 5 reasons why we should accept facebooks olive branch,REAL
netanyahu scores stunning victory   but at what cost video,REAL
obama us cannot solve the worlds problems alone,REAL
angela merkel to visit white house on feb 9,REAL
in a break with obama clinton lays out tougher worldview,REAL
charting a course for charter schools,REAL
house votes to upgrade international religious freedom law,REAL
ryan meets trump says very encouraged but unity will take time,REAL
arizona cops body cam captures fatal encounter with suspect,REAL
its time for republican party leaders to embrace marriage equality,REAL
the gops ludicrous kim davis primary how raging homophobia took the republican campaign by storm,REAL
pope francis announces biggest changes to annulment process in centuries,REAL
actually many trump voters are in one basket and its both racist and economically frustrated,REAL
ted cruz says gop leaders planned to cave on immigration all along,REAL
gops demonic new crusade right wing zealots look for even crueler ways to treat the poor like garbage,REAL
obama hits 50 approval rating in poll,REAL
is the gop losing walmart,REAL
the republican party ruined conservatism long before trump why they still dont get it,REAL
boehner takes revenge,REAL
a nuclear deal has been reached but iran must free jason rezaian,REAL
frustrated trump advisers pan him for lousy debate prep anonymously,REAL
americas looming freak show how gop control in 2015 will terrorize a nation   with no political repercussion,REAL
trump doctors letter he takes cholesterol drug is overweight but is in excellent health,REAL
putting presidential polls in perspective,REAL
egypt says it hit isis targets in libya after killings,REAL
facebook is full of fake news stories on election day dont fall for them,REAL
we dont just need to see trumps taxes  we need a real medical report on him,REAL
obama trump is unfit to serve as president,REAL
the white house wants to cut methane emissions from oil and gas operations,REAL
yes bernie polls better against trump than hillarybut theres a catch,REAL
kurdish forces backed by us airstrikes launch offensive in iraq,REAL
wake up america our country is upside down,REAL
donald trumps white fascist brigade his rallies are now a safe space for racism,REAL
harry reid calls trade push by obama and gop insanity,REAL
retaliating for killings egypt launches airstrikes against isis in libya,REAL
miracles man metaxas vs closed minds and a closed universe,REAL
president obamas persistent and puzzling passivity on terrorism,REAL
treasury will begin issuing iran sanctions waivers under obama order,REAL
the new war on the press when satire sparks terrorism,REAL
john mccain nsa phone surveillance program is necessary,REAL
sparks fly between clinton and sanders at flint debate,REAL
south carolina police officer charged with murder after shooting man during traffic stop,REAL
obamacare case all eyes on 2 justices,REAL
bush and romney ready to rumble,REAL
why we miss the unpolarizing pat moynihan,REAL
political paralysis is the new normal the gops scalia gamble may be suicidal but its not illogical,REAL
an obama boom,REAL
memeoftheweek that article from the onion about mass shootings,REAL
super pac gets early start on pushing for a 2016 clinton campaign,REAL
obama again delays afghanistan troop drawdown,REAL
democrats propose internet voting in 2016 making republicans also consider the idea,REAL
first take wall street bids goodbye to june hike,REAL
where is the public outcry for an explanation of how the longest war in american history is on a course to end in failure,REAL
republican elders ask whos worse for the gop brand trump or cruz,REAL
pentagon weighs using force to protect us backed syria rebels targeted by russia,REAL
south carolina black voters not feelin the bern,REAL
congressional republicans declare obamas budget dead on arrival,REAL
isis claims responsibility for garland texas shooting,REAL
white house says obama will ask congress to authorize military force against isis,REAL
sanders launches late stage bid to woo superdelegates,REAL
bernie sanders hillary clinton battle for california,REAL
gerrymandering didnt make politics this vicious but vicious politics will soon make gerrymandering so much worse,REAL
clinton makes history declares win in democratic race,REAL
7 times obama failed to support israel,REAL
obama details his disappointment with netanyahu in first post election comments,REAL
wasserman schultz on sanders response to nevada chaos anything but acceptable,REAL
hillary clinton attacks donald trump for threatening to sue accusers,REAL
in ethiopia obama seeks progress on peace security in east africa,REAL
activists bristle at clinton fundraising,REAL
carson doubles down on muslim comments sharia inconsistent with constitution,REAL
huckabee resisting the supreme court on gay marriage,REAL
turnout is name of the game in iowa caucuses,REAL
the biggest thing iran deal critics get wrong in one paragraph,REAL
biden heads to iowa fueling 2016 speculation,REAL
scott walkers campaign is in deep deep trouble,REAL
trump willing to meet nkoreas kim wants to renegotiate paris climate accord,REAL
protests at donald trump rally overshadow washington primary win,REAL
republican debate trumps absence leaves three winners and two losers,REAL
palins endorsement the latest prize as trump cruz battle for conservatives,REAL
the best lines from president obamas speech according to the white house,REAL
shutdown clash to return in force by december,REAL
at least 20 hostages dead in siege of hotel in mali official says,REAL
bill oreilly claims false admits fox news why that wont hurt him at fox,REAL
donald trump rages against the machine,REAL
3 winners and 2 losers from saturday nights republican debate,REAL
taliban claim responsibility for kabul attack,REAL
isis launches attack on kirkuk,REAL
islamic state accepts boko haram allegiance pledge,REAL
how come the us keeps killing isis no 2s,REAL
california governor signs bill to automatically register people to vote,REAL
how donald trump wins even when he loses,REAL
ted cruz the master strategist was no match for trumps cult of personality,REAL
mentally ill officer give me back my gun,REAL
on the streets of baltimore trying to understand the anger,REAL
bushs 2016 remarks kick other potential gop candidates into higher gears,REAL
gov jindal thinking and praying about 2016 run   politicscom,REAL
the sad truth about melania trumps plagiarism snafu,REAL
the clock is ticking and republicans still have no serious obamacare alternative,REAL
lawmakers fuming over report capitol police left guns in bathrooms,REAL
ted cruz democratic party home to liberal fascism against christians,REAL
white house brings lawmakers into situation room on iran,REAL
white house obama would veto keystone bill,REAL
us officials optimistic they will close giant trade deal,REAL
donald trump a threat the founding fathers foresaw he proves the need for the electoral college  and is the best case for superdelegates,REAL
congress in slow lane on auto safety,REAL
clinton aide key focus in fbi server investigation,REAL
obamacare fallout supreme court ruling sets up potential obama gop battle,REAL
ap fact check the republican debaters and the facts,REAL
arab officials warn us of giving isis a propaganda win,REAL
letting trump and the gop self destruct hillary and democrats have the right strategy by laying low,REAL
sorry hillary but were done keep repeating racist myths and praising kissinger and the reagans im switching to bernie sanders,REAL
taking trump voters concerns seriously means listening to what theyre actually saying,REAL
christie fiorina suspend 2016 campaigns,REAL
the destroyer cometh,REAL
hillary isnt winning over many pundits even on the left,REAL
hillary clinton apologizes for e mail system i take responsibility,REAL
hillary clinton tributes fuel 2016 buzz,REAL
mulling 2016 run biden speaks with top labor leader,REAL
in bronx sanders voters find more common ground with trump than clinton,REAL
clinton trump and obama arent telling american workers the truth here it is,REAL
the inside story of trump campaigns connections to a big money super pac,REAL
the myth of the anchor baby deportation defense,REAL
republican national convention speakers including wife melania testify to donald trumps readiness to be president others savage clinton,REAL
why clinton remains inevitable  almost,REAL
why obama has his work cut out for him on getting trade votes,REAL
congress moves closer to preventing a shutdown,REAL
ted cruz launches bid some pundits paint him as scary extremist,REAL
donald trumps collapse was caused by one big factor hillary clinton,REAL
determined to kill can tough gun laws end mass shootings,REAL
this republican senator visited a mosque to repudiate donald trump,REAL
high school middle school kids now use more e cigs than tobacco cdc,REAL
new senate is just like the old senate,REAL
republicans fear 2 more years of gridlock,REAL
supreme court to consider redefining one person one vote principle,REAL
